{
  "trace_id": "ohnd-replay-001-add1bc0bb2",
  "case_id": "ohnd-replay-001",
  "created_at": "2026-10-24T04:47:26Z",
  "replay": true,
  "status": "done",
  "source": "engine",
  "method": {
    "accounting": "FIFO",
    "max_hops": 8,
    "max_branches_per_node": 12,
    "min_amount": 100.0,
    "max_api_calls": 400,
    "engine_version": "0.3",
    "as_of_block": 20170085,
    "freeze_visibility": "hidden",
    "confidence_model": {
      "base": {
        "direct": 1.0,
        "consolidation": 0.9,
        "swap": 0.9,
        "peel": 0.85,
        "bridge_match": 0.6
      },
      "completeness": {
        "complete": 1.0,
        "incomplete": 0.5
      }
    }
  },
  "seeds": [
    {
      "seed_id": "s1",
      "tx_hash": "0xc36ac0e14af4a2e07929aa01c046848424cef534a435cc76b624c66f7eaa8eeb",
      "token": "USDT",
      "amount": 101352.431358
    },
    {
      "seed_id": "s2",
      "tx_hash": "0x038a4a2506815cf4de8cb0a74a48fe759acc5215237229f208f2f2c0c4afe11f",
      "token": "USDT",
      "amount": 67585.034172
    },
    {
      "seed_id": "s3",
      "tx_hash": "0x7268269f9b95788f6898c47c4f4c0e34d9ab7826ef5a91cab07c07421f10a9f9",
      "token": "USDT",
      "amount": 151486.630813
    },
    {
      "seed_id": "s4",
      "tx_hash": "0x831e92ba5d0130e9338d094fe0117813606ac4f7c76db452cb145ecd3f0da43e",
      "token": "USDT",
      "amount": 49105.324161
    },
    {
      "seed_id": "s5",
      "tx_hash": "0x40eac76d70e28009d7f7a7dce7c7b59c5ecc1c54260decef6f9ef943fd1b5f82",
      "token": "USDT",
      "amount": 21505.388711
    },
    {
      "seed_id": "s6",
      "tx_hash": "0xc876042a60a8a8c426dfaf698cebbae337f21fb812a1211bf249176b7863ce3d",
      "token": "USDT",
      "amount": 10.0
    },
    {
      "seed_id": "s7",
      "tx_hash": "0x00e8102ad8c67db293b9025e419128e269c2b32100f78c769109557bb2fe07cf",
      "token": "USDT",
      "amount": 38386.213601
    },
    {
      "seed_id": "s8",
      "tx_hash": "0x21d250c54b950862f2ee1fb93bcdea6faa445f277d40321ebc9d471ae8574032",
      "token": "USDT",
      "amount": 92750.465813
    },
    {
      "seed_id": "s9",
      "tx_hash": "0xd14fe0a57c0d5c8f1641fc474d2460bf381810ae7f8d73adb3ef7d52650b2413",
      "token": "USDT",
      "amount": 58537.736274
    },
    {
      "seed_id": "s10",
      "tx_hash": "0xe49db7eb0e1316a9320413541374c5d4323ba5720b891384433a1886cedb34bb",
      "token": "USDT",
      "amount": 19038.02
    },
    {
      "seed_id": "s11",
      "tx_hash": "0x71e9965b057fa1a3eb2f732bf48551d7cdf0988912122d1867a2fb642f97fb5d",
      "token": "USDT",
      "amount": 32198.843218
    },
    {
      "seed_id": "s12",
      "tx_hash": "0x44de255b168a6930af19f6f4c310ca0f2fbeed121736b8377e1ff05db6720bbb",
      "token": "USDT",
      "amount": 19526.63
    },
    {
      "seed_id": "s13",
      "tx_hash": "0xc9c4c9e499fd05df12b9498d8e37dc47c2ef31ef4cbea0870e7c1fc767d5ce60",
      "token": "USDT",
      "amount": 71194.228148
    },
    {
      "seed_id": "s14",
      "tx_hash": "0x1d011478324d4b6bf583dadd66e2c4bd49b1c4443d96b074d51152e03a03a1cb",
      "token": "USDT",
      "amount": 10906.585715
    },
    {
      "seed_id": "s15",
      "tx_hash": "0x064b32f9fbb4da0347e0a8a7793d0e3b4848e28eafdf29dc8502bf28150b261c",
      "token": "USDT",
      "amount": 20217.191575
    },
    {
      "seed_id": "s16",
      "tx_hash": "0x21be34089a7da7e4425c164de22f2817ade111e8a96f622f424b4bf6e939283f",
      "token": "USDT",
      "amount": 19528.97
    },
    {
      "seed_id": "s17",
      "tx_hash": "0x68be3cb0c689b285e325c87f0051e5c190900ef9dfbd9773e71ee039d99d8df8",
      "token": "USDT",
      "amount": 93480.534389
    },
    {
      "seed_id": "s18",
      "tx_hash": "0x00fe28a2b4c9cba1c2c8ae00546607508391899bee38fd8d29991e8d79ebeea0",
      "token": "USDT",
      "amount": 12.0
    },
    {
      "seed_id": "s19",
      "tx_hash": "0x8fa1c25f366482407149ef6d851ddbc2392c00f21df0472198b18d42dfff8406",
      "token": "USDT",
      "amount": 19896.3
    },
    {
      "seed_id": "s20",
      "tx_hash": "0x070f64018f8eed7ac116b6e83ba949ab658710270f641ed7262e750027501fb7",
      "token": "USDT",
      "amount": 28599.308366
    }
  ],
  "nodes": [
    {
      "address": "0x3275ffa5d1baf825a7facda4c82d6a89982d4b4f",
      "chain": "ethereum",
      "kind": "victim",
      "label": null,
      "label_source": null,
      "classifier": null,
      "balance_usdt": null,
      "frozen": {
        "is_frozen": false,
        "frozen_at": null,
        "freeze_tx": null
      },
      "depth": 0
    },
    {
      "address": "0x4a14347083b80e5216ca31350a2d21702ac3650d",
      "chain": "ethereum",
      "kind": "victim",
      "label": null,
      "label_source": null,
      "classifier": null,
      "balance_usdt": null,
      "frozen": {
        "is_frozen": false,
        "frozen_at": null,
        "freeze_tx": null
      },
      "depth": 0
    },
    {
      "address": "0x83c877f684fd6ca616907538bba12c85c1d26a34",
      "chain": "ethereum",
      "kind": "victim",
      "label": null,
      "label_source": null,
      "classifier": null,
      "balance_usdt": null,
      "frozen": {
        "is_frozen": false,
        "frozen_at": null,
        "freeze_tx": null
      },
      "depth": 0
    },
    {
      "address": "0x8d90113a1e286a5ab3e496fbd1853f265e5913c6",
      "chain": "ethereum",
      "kind": "victim",
      "label": null,
      "label_source": null,
      "classifier": null,
      "balance_usdt": null,
      "frozen": {
        "is_frozen": false,
        "frozen_at": null,
        "freeze_tx": null
      },
      "depth": 0
    },
    {
      "address": "0x91c986709bb4fe0763edf8e2690ee9d5019bea4a",
      "chain": "ethereum",
      "kind": "victim",
      "label": null,
      "label_source": null,
      "classifier": null,
      "balance_usdt": null,
      "frozen": {
        "is_frozen": false,
        "frozen_at": null,
        "freeze_tx": null
      },
      "depth": 0
    },
    {
      "address": "0x923187ae5c59f972dd821bc584da2743da1e80a6",
      "chain": "ethereum",
      "kind": "victim",
      "label": null,
      "label_source": null,
      "classifier": null,
      "balance_usdt": null,
      "frozen": {
        "is_frozen": false,
        "frozen_at": null,
        "freeze_tx": null
      },
      "depth": 0
    },
    {
      "address": "0xcf9bbfa762ef5a84ba3d25350de941a6db485027",
      "chain": "ethereum",
      "kind": "intermediate",
      "label": null,
      "label_source": null,
      "classifier": {
        "kind": "unknown",
        "confidence": 0.5,
        "reasons": [
          "collects from many senders and sweeps to one wallet that is not a known exchange: could be a scam collection wallet, keep tracing"
        ]
      },
      "balance_usdt": null,
      "frozen": {
        "is_frozen": false,
        "frozen_at": null,
        "freeze_tx": null
      },
      "depth": 1
    },
    {
      "address": "0x78366b2f6c5321ac30629c078120385ae2da1a06",
      "chain": "ethereum",
      "kind": "intermediate",
      "label": null,
      "label_source": null,
      "classifier": {
        "kind": "unknown",
        "confidence": 0.5,
        "reasons": [
          "no exchange-like pattern"
        ]
      },
      "balance_usdt": null,
      "frozen": {
        "is_frozen": false,
        "frozen_at": null,
        "freeze_tx": null
      },
      "depth": 2
    },
    {
      "address": "0x07fbb418aac62abc4ca3e7ee8ccf8ce7693e9d53",
      "chain": "ethereum",
      "kind": "holding",
      "label": null,
      "label_source": null,
      "classifier": {
        "kind": "unknown",
        "confidence": 0.5,
        "reasons": [
          "no exchange-like pattern"
        ]
      },
      "balance_usdt": 0.0,
      "frozen": {
        "is_frozen": false,
        "frozen_at": null,
        "freeze_tx": null
      },
      "depth": 3
    },
    {
      "address": "0x8009a080442c001250b49fac4ff483522bba7207",
      "chain": "ethereum",
      "kind": "holding",
      "label": null,
      "label_source": null,
      "classifier": {
        "kind": "unknown",
        "confidence": 0.5,
        "reasons": [
          "no exchange-like pattern"
        ]
      },
      "balance_usdt": 0.0,
      "frozen": {
        "is_frozen": false,
        "frozen_at": null,
        "freeze_tx": null
      },
      "depth": 3
    },
    {
      "address": "0x9eb0c71e79066552bdd05a69fc4dcac075db5e1f",
      "chain": "ethereum",
      "kind": "holding",
      "label": null,
      "label_source": null,
      "classifier": {
        "kind": "unknown",
        "confidence": 0.5,
        "reasons": [
          "no exchange-like pattern"
        ]
      },
      "balance_usdt": 0.0,
      "frozen": {
        "is_frozen": false,
        "frozen_at": null,
        "freeze_tx": null
      },
      "depth": 3
    },
    {
      "address": "0x58e99d9413bb6ce05748a84f76e5fff4bb2d0dcb",
      "chain": "ethereum",
      "kind": "intermediate",
      "label": null,
      "label_source": null,
      "classifier": {
        "kind": "unknown",
        "confidence": 0.5,
        "reasons": [
          "no exchange-like pattern"
        ]
      },
      "balance_usdt": null,
      "frozen": {
        "is_frozen": false,
        "frozen_at": null,
        "freeze_tx": null
      },
      "depth": 4
    },
    {
      "address": "0xdf6fa72c71577c3a3209db202d4815021f0ed53f",
      "chain": "ethereum",
      "kind": "intermediate",
      "label": null,
      "label_source": null,
      "classifier": {
        "kind": "unknown",
        "confidence": 0.5,
        "reasons": [
          "collects from many senders and sweeps to one wallet that is not a known exchange: could be a scam collection wallet, keep tracing"
        ]
      },
      "balance_usdt": null,
      "frozen": {
        "is_frozen": false,
        "frozen_at": null,
        "freeze_tx": null
      },
      "depth": 4
    },
    {
      "address": "0x4e5cda8f0d772ac57e947545192a0657ad47abb5",